{
  "contract": "MetricSignalSemanticsV1",
  "metric_id": "abf_company_revenue_yoy::3037.TW",
  "company": "3037.TW",
  "product": "ABF",
  "source_scope": "COMPANY_TOTAL",
  "measure_kind": "CHANGE",
  "change_basis": "YOY",
  "transform": "LEVEL",
  "unit": "percent",
  "accounting_basis": "CONSOLIDATED_REPORTED",
  "return_basis": "NOT_APPLICABLE",
  "is_proxy": true,
  "evidence_status": "DERIVED",
  "pit_basis": "PROXY",
  "observation_date": "2026-08-31T00:00:00+08:00",
  "release_date": null,
  "available_at": "2026-09-10T23:59:59+08:00",
  "signal_generated_at": "2026-10-23T00:00:00+08:00",
  "signal_value": 12,
  "source_urls": ["https://example.com/mops-fixture"],
  "observation_id": "fixture-3037-202608",
  "dependency_ids": ["fixture-3037-202608"]
}
